{
  "slug": "iron-basics-7",
  "title": "Железо в тарелке: 7 дней",
  "description": "Короткий вводный курс о питании при низком гемоглобине: что помогает усвоению железа, что мешает, и когда пора к врачу.",
  "targetAudience": "Adult",
  "durationDays": 7,
  "contentStatus": "Draft",
  "doctorReviewerName": null,
  "days": [
    {
      "dayNumber": 1,
      "isRescanCheckpoint": true,
      "theory": "## С чего начинаем\n\nСегодня две задачи: сделать стартовый снимок и разобраться, зачем организму железо.\n\nЖелезо нужно для гемоглобина — белка, который переносит кислород. Когда железа мало, кислорода тканям не хватает: отсюда усталость, одышка на лестнице, бледность, ломкость волос и ногтей.\n\n**Важно понимать с первого дня:** снимок глаза — это скрининговая оценка, а не анализ крови. Курс помогает наладить питание и образ жизни. Он не заменяет врача и не ставит диагноз.",
      "tasks": [
        { "title": "Сделать стартовый снимок", "description": "Он станет точкой отсчёта для графика в разделе прогресса." },
        { "title": "Записать, как вы себя чувствуете", "description": "Усталость, одышка, головокружение — отметьте, что есть сейчас, чтобы через неделю было с чем сравнить." }
      ]
    },
    {
      "dayNumber": 2,
      "isRescanCheckpoint": false,
      "theory": "## Два вида железа\n\nЖелезо из пищи бывает двух видов, и усваиваются они по-разному.\n\n**Гемовое** — из продуктов животного происхождения: красное мясо, печень, субпродукты. Усваивается легко.\n\n**Негемовое** — из растительной пищи: бобовые, гречка, шпинат, тофу, семена тыквы. Усваивается заметно хуже, но его доля в рационе обычно больше.\n\nВывод простой: если вы не едите мясо, за железом нужно следить внимательнее — и тем важнее приёмы из следующих дней.",
      "tasks": [
        { "title": "Добавить в день один источник железа", "description": "Говядина, печень, чечевица, фасоль, гречка или тыквенные семечки — на ваш выбор." }
      ]
    },
    {
      "dayNumber": 3,
      "isRescanCheckpoint": false,
      "theory": "## Витамин C — главный союзник\n\nВитамин C в том же приёме пищи заметно улучшает усвоение негемового железа. Это самый простой приём во всём курсе: ничего не нужно покупать, достаточно сочетать.\n\nЧто работает: болгарский перец, брокколи, цитрусовые, киви, квашеная капуста, свежая зелень, томаты.\n\nПример: гречка с тушёными овощами и салатом из перца усвоится лучше, чем та же гречка отдельно.",
      "tasks": [
        { "title": "Добавить овощ или фрукт с витамином C к приёму с железом", "description": "Перец, брокколи, цитрус, киви, зелень или квашеная капуста." }
      ]
    },
    {
      "dayNumber": 4,
      "isRescanCheckpoint": true,
      "theory": "## Что мешает усвоению\n\nЕсть привычки, которые сводят усилия на нет.\n\n**Чай и кофе.** Танины связывают железо. Если пить их вместе с едой, усвоение падает. Решение не в отказе — достаточно развести по времени примерно на час до и после еды.\n\n**Кальций.** Молочные продукты конкурируют с железом за усвоение. Разносите их с «железными» приёмами по разным приёмам пищи.\n\nСегодня середина курса — хороший момент сделать второй снимок и посмотреть на динамику.",
      "tasks": [
        { "title": "Сделать контрольный снимок" },
        { "title": "Развести чай и кофе с едой", "description": "Примерно час до и час после приёма пищи с железом." }
      ]
    },
    {
      "dayNumber": 5,
      "isRescanCheckpoint": false,
      "theory": "## Сон и восстановление\n\nПри дефиците железа усталость накапливается быстрее, а недосып её усиливает — получается замкнутый круг.\n\nЗдесь нет хитростей: регулярное время отхода ко сну, 7–9 часов, без экрана перед сном. Это не вылечит дефицит, но заметно влияет на то, как вы себя чувствуете, пока питание выравнивается.\n\nИ ещё: если усталость резко усилилась, появилось сильное сердцебиение в покое или одышка при обычной нагрузке — это повод не ждать конца курса, а обратиться к врачу.",
      "tasks": [
        { "title": "Лечь спать в одно и то же время" }
      ]
    },
    {
      "dayNumber": 6,
      "isRescanCheckpoint": false,
      "theory": "## Когда идти к врачу\n\nСамая важная тема курса.\n\nПитание помогает поддерживать уровень железа, но **не выясняет причину** его дефицита. А причина бывает разной: обильные менструации, скрытая кровопотеря, нарушение всасывания, беременность, период восстановления после родов.\n\nЕдинственный способ узнать настоящий уровень гемоглобина — **общий анализ крови**. Он недорогой и делается в любой лаборатории.\n\nОбратитесь к врачу, если: симптомы не уходят, усталость мешает обычным делам, есть сильное сердцебиение или одышка, либо вы беременны или кормите.\n\n**Никаких препаратов железа без назначения.** Избыток железа так же вреден, как недостаток, и определить нужную форму и дозу может только врач по результатам анализа.",
      "tasks": [
        { "title": "Записаться на общий анализ крови", "description": "Если уже сдавали недавно — найдите результат и посмотрите на показатель гемоглобина." }
      ]
    },
    {
      "dayNumber": 7,
      "isRescanCheckpoint": true,
      "theory": "## Итоги недели\n\nЗа неделю вы разобрали четыре вещи: откуда берётся железо, чем помочь его усвоению, что ему мешает и когда нужен врач.\n\nСделайте финальный снимок — в разделе прогресса появится график по всем трём контрольным точкам.\n\nЧестная оговорка напоследок: неделя — слишком короткий срок, чтобы уровень гемоглобина заметно изменился. Восстановление запасов железа занимает месяцы. Этот курс — про привычки, а не про быстрый результат. И про то, чтобы дойти до анализа крови.",
      "tasks": [
        { "title": "Сделать финальный снимок" },
        { "title": "Сравнить самочувствие с первым днём", "description": "Вернитесь к заметке из дня 1." }
      ]
    }
  ]
}
